{
  "view": { "center": { "lat": 53.34399, "lng": -6.26221 }, "zoom": 13 },
  "markers": [
    { "lat": 53.35, "lng": -6.27, "feature": "cafe", "color": "red", "label": "Coffee" }
  ],
  "lines": [
    { "points": [{ "lat": 53.3, "lng": -6.2 }, { "lat": 53.31, "lng": -6.21 }], "width": 4 }
  ],
  "meta": { "title": "Dublin trip" }
}
